<?xml version="1.0" encoding="UTF-8"?>
<hoadon xmlns:xsi="http://www.w3.org/2001/XMLSchema-instance"
    xsi:noNamespaceSchemaLocation="index.xsd">
    <sohoadon>1</sohoadon>
    <hoten>Nguyễn Văn A</hoten>
    <ngaylap>2020-06-01</ngaylap>
    <dichvu>
        <mathang>
            <ten>Thuê phòng</ten>
            <loai>A</loai>
            <soluong>4</soluong>
            <dongia>600000</dongia>
            <thanhtien>2400000</thanhtien>
        </mathang>

        <mathang>
            <ten>Thuê xe</ten>
            <loai>4 chỗ</loai>
            <soluong>5</soluong>
            <dongia>150000</dongia>
            <thanhtien>750000</thanhtien>
        </mathang>

        <mathang>
            <ten>Điện thoại</ten>
            <loai>1</loai>
            <soluong>10</soluong>
            <dongia>50000</dongia>
            <thanhtien>500000</thanhtien>
        </mathang>
    </dichvu>
    <tongtien>3650000</tongtien>
</hoadon>

<!-- 
//hoadon/sohoadon
//hoadon/hoten
//hoadon/ngaylap
//hoadon/tongtien
//dichvu/mathan
//Lấy tất cả các mặt hàng có loại "A"
//mathang[loai = "A"]
//mathang[ten = "Thuê xe"]
//mathang[dongia > 500000]
//mathang[1]/soluong
//mathang[last()]/thanhtien
Đếm tổng số mặt hàng trong hóa đơn
count(//mathang)
Tính tổng số lượng tất cả các mặt hàng
sum(//mathang/soluong)
Lấy mặt hàng có thành tiền cao nhất
//mathang[thanhtien = max(//mathang/thanhtien)]
Lấy tất cả mặt hàng có số lượng >= 5
//mathang[soluong >= 5]
Lấy loại của mặt hàng có tên chứa chữ "xe"
//mathang[contains(ten, "xe")]/loai -->
<!-- 
<serviceList>
{
  let $service := //mathang
  for $item in $service
    return
      <service>
        <name>{string($item/ten)}</name>
        <type>{string($item/loai)}</type>
        <quantity>{xs:integer($item/soluong)}</quantity>
        <price>{xs:integer($item/dongia)}</price>
        <amount>{xs:integer($item/thanhtien)}</amount>
      </service>
}
</serviceList> -->